{
  "$schema": "https://json-schema.org/draft/2020-12/schema",
  "title": "OpenPhenology slugs/1",
  "description": "Species page slugs, and redirects from old slugs.",
  "type": "object",
  "required": [
    "id",
    "kind",
    "format",
    "provenance",
    "data"
  ],
  "properties": {
    "id": {
      "type": "string",
      "pattern": "^releases/\\d{4}-\\d{2}-\\d{2}/slugs(/\\d+)?\\.json$"
    },
    "kind": {
      "const": "slugs"
    },
    "format": {
      "type": "string",
      "pattern": "^slugs/1\\.\\d+$"
    },
    "provenance": {
      "type": "object",
      "required": [
        "release",
        "sources",
        "licences",
        "gbif_download_dois",
        "method",
        "taxonomy",
        "boundaries",
        "ranges",
        "protection",
        "code",
        "run"
      ],
      "properties": {
        "release": {
          "type": "string",
          "pattern": "^\\d{4}-\\d{2}-\\d{2}$"
        },
        "sources": {
          "type": "array",
          "items": {
            "type": "string"
          }
        },
        "licences": {
          "type": "array",
          "items": {
            "type": "string"
          }
        },
        "gbif_download_dois": {
          "type": "array",
          "items": {
            "type": "string"
          }
        },
        "method": {
          "anyOf": [
            {
              "type": "string"
            },
            {
              "type": "null"
            }
          ]
        },
        "taxonomy": {
          "anyOf": [
            {
              "type": "string"
            },
            {
              "type": "null"
            }
          ]
        },
        "boundaries": {
          "anyOf": [
            {
              "type": "string"
            },
            {
              "type": "null"
            }
          ]
        },
        "ranges": {
          "anyOf": [
            {
              "type": "array",
              "items": {
                "type": "string"
              }
            },
            {
              "type": "null"
            }
          ]
        },
        "protection": {
          "anyOf": [
            {
              "type": "object",
              "additionalProperties": {
                "type": "string"
              }
            },
            {
              "type": "null"
            }
          ]
        },
        "code": {
          "anyOf": [
            {
              "type": "string"
            },
            {
              "type": "null"
            }
          ]
        },
        "run": {
          "anyOf": [
            {
              "type": "string"
            },
            {
              "type": "null"
            }
          ]
        }
      }
    },
    "data": {
      "type": "object",
      "required": [
        "species",
        "redirects"
      ],
      "properties": {
        "species": {
          "type": "object",
          "propertyNames": {
            "type": "string",
            "pattern": "^[a-z0-9]+(-[a-z0-9]+)*$"
          },
          "additionalProperties": {
            "type": "string",
            "pattern": "^[A-Za-z0-9._-]+$"
          }
        },
        "redirects": {
          "type": "object",
          "propertyNames": {
            "type": "string",
            "pattern": "^[a-z0-9]+(-[a-z0-9]+)*$"
          },
          "additionalProperties": {
            "type": "string",
            "pattern": "^[a-z0-9]+(-[a-z0-9]+)*$"
          }
        }
      }
    }
  }
}
